{
  "schema_version": "1.0.0",
  "crs": {
    "epsg": 32631,
    "units": "metre"
  },
  "lattice": {
    "origin_x_m": 434776.0,
    "origin_y_m": 4584057.0,
    "cell_size_m": 6.0,
    "cols": 139,
    "rows": 153
  },
  "cells": [
    {
      "x_m": 435139.0,
      "y_m": 4584174.0,
      "crowd_density_agents_per_cell": 1.0
    },
    {
      "x_m": 435091.0,
      "y_m": 4584162.0,
      "crowd_density_agents_per_cell": 9.0
    },
    {
      "x_m": 435037.0,
      "y_m": 4584120.0,
      "crowd_density_agents_per_cell": 10.0
    },
    {
      "x_m": 435349.0,
      "y_m": 4584366.0,
      "crowd_density_agents_per_cell": 10.0
    },
    {
      "x_m": 435361.0,
      "y_m": 4584438.0,
      "crowd_density_agents_per_cell": 1.0
    },
    {
      "x_m": 435379.0,
      "y_m": 4584552.0,
      "crowd_density_agents_per_cell": 4.0
    },
    {
      "x_m": 435031.0,
      "y_m": 4584618.0,
      "crowd_density_agents_per_cell": 44.0
    },
    {
      "x_m": 435193.0,
      "y_m": 4584480.0,
      "crowd_density_agents_per_cell": 5.0
    },
    {
      "x_m": 435451.0,
      "y_m": 4584624.0,
      "crowd_density_agents_per_cell": 1.0
    },
    {
      "x_m": 435139.0,
      "y_m": 4584558.0,
      "crowd_density_agents_per_cell": 1.0
    },
    {
      "x_m": 435379.0,
      "y_m": 4584504.0,
      "crowd_density_agents_per_cell": 13.0
    },
    {
      "x_m": 435331.0,
      "y_m": 4584870.0,
      "crowd_density_agents_per_cell": 4.0
    },
    {
      "x_m": 435037.0,
      "y_m": 4584630.0,
      "crowd_density_agents_per_cell": 18.0
    },
    {
      "x_m": 435025.0,
      "y_m": 4584606.0,
      "crowd_density_agents_per_cell": 6.0
    },
    {
      "x_m": 435457.0,
      "y_m": 4584606.0,
      "crowd_density_agents_per_cell": 6.0
    },
    {
      "x_m": 435037.0,
      "y_m": 4584636.0,
      "crowd_density_agents_per_cell": 6.0
    },
    {
      "x_m": 435085.0,
      "y_m": 4584630.0,
      "crowd_density_agents_per_cell": 2.0
    },
    {
      "x_m": 435367.0,
      "y_m": 4584426.0,
      "crowd_density_agents_per_cell": 11.0
    },
    {
      "x_m": 435493.0,
      "y_m": 4584594.0,
      "crowd_density_agents_per_cell": 3.0
    },
    {
      "x_m": 435307.0,
      "y_m": 4584324.0,
      "crowd_density_agents_per_cell": 3.0
    },
    {
      "x_m": 435379.0,
      "y_m": 4584678.0,
      "crowd_density_agents_per_cell": 2.0
    },
    {
      "x_m": 435073.0,
      "y_m": 4584150.0,
      "crowd_density_agents_per_cell": 3.0
    },
    {
      "x_m": 435337.0,
      "y_m": 4584432.0,
      "crowd_density_agents_per_cell": 1.0
    },
    {
      "x_m": 435337.0,
      "y_m": 4584666.0,
      "crowd_density_agents_per_cell": 1.0
    },
    {
      "x_m": 435343.0,
      "y_m": 4584384.0,
      "crowd_density_agents_per_cell": 1.0
    },
    {
      "x_m": 435307.0,
      "y_m": 4584300.0,
      "crowd_density_agents_per_cell": 7.0
    },
    {
      "x_m": 435121.0,
      "y_m": 4584186.0,
      "crowd_density_agents_per_cell": 3.0
    },
    {
      "x_m": 435379.0,
      "y_m": 4584672.0,
      "crowd_density_agents_per_cell": 4.0
    },
    {
      "x_m": 435343.0,
      "y_m": 4584360.0,
      "crowd_density_agents_per_cell": 9.0
    },
    {
      "x_m": 435055.0,
      "y_m": 4584654.0,
      "crowd_density_agents_per_cell": 1.0
    },
    {
      "x_m": 435049.0,
      "y_m": 4584654.0,
      "crowd_density_agents_per_cell": 2.0
    },
    {
      "x_m": 435325.0,
      "y_m": 4584828.0,
      "crowd_density_agents_per_cell": 1.0
    },
    {
      "x_m": 435109.0,
      "y_m": 4584624.0,
      "crowd_density_agents_per_cell": 2.0
    },
    {
      "x_m": 435463.0,
      "y_m": 4584606.0,
      "crowd_density_agents_per_cell": 5.0
    },
    {
      "x_m": 435343.0,
      "y_m": 4584390.0,
      "crowd_density_agents_per_cell": 1.0
    },
    {
      "x_m": 435181.0,
      "y_m": 4584534.0,
      "crowd_density_agents_per_cell": 2.0
    },
    {
      "x_m": 435127.0,
      "y_m": 4584546.0,
      "crowd_density_agents_per_cell": 3.0
    },
    {
      "x_m": 435049.0,
      "y_m": 4584132.0,
      "crowd_density_agents_per_cell": 10.0
    },
    {
      "x_m": 435559.0,
      "y_m": 4584660.0,
      "crowd_density_agents_per_cell": 21.0
    },
    {
      "x_m": 435373.0,
      "y_m": 4584564.0,
      "crowd_density_agents_per_cell": 2.0
    },
    {
      "x_m": 435427.0,
      "y_m": 4584696.0,
      "crowd_density_agents_per_cell": 2.0
    },
    {
      "x_m": 435133.0,
      "y_m": 4584612.0,
      "crowd_density_agents_per_cell": 5.0
    },
    {
      "x_m": 435109.0,
      "y_m": 4584732.0,
      "crowd_density_agents_per_cell": 1.0
    },
    {
      "x_m": 435043.0,
      "y_m": 4584126.0,
      "crowd_density_agents_per_cell": 15.0
    },
    {
      "x_m": 435079.0,
      "y_m": 4584624.0,
      "crowd_density_agents_per_cell": 16.0
    },
    {
      "x_m": 435331.0,
      "y_m": 4584438.0,
      "crowd_density_agents_per_cell": 5.0
    },
    {
      "x_m": 435523.0,
      "y_m": 4584576.0,
      "crowd_density_agents_per_cell": 2.0
    },
    {
      "x_m": 435355.0,
      "y_m": 4584450.0,
      "crowd_density_agents_per_cell": 3.0
    },
    {
      "x_m": 435553.0,
      "y_m": 4584654.0,
      "crowd_density_agents_per_cell": 6.0
    },
    {
      "x_m": 435331.0,
      "y_m": 4584390.0,
      "crowd_density_agents_per_cell": 1.0
    },
    {
      "x_m": 435385.0,
      "y_m": 4584522.0,
      "crowd_density_agents_per_cell": 21.0
    },
    {
      "x_m": 435343.0,
      "y_m": 4584720.0,
      "crowd_density_agents_per_cell": 4.0
    },
    {
      "x_m": 435259.0,
      "y_m": 4584702.0,
      "crowd_density_agents_per_cell": 1.0
    },
    {
      "x_m": 435307.0,
      "y_m": 4584702.0,
      "crowd_density_agents_per_cell": 2.0
    },
    {
      "x_m": 435109.0,
      "y_m": 4584696.0,
      "crowd_density_agents_per_cell": 2.0
    },
    {
      "x_m": 435211.0,
      "y_m": 4584480.0,
      "crowd_density_agents_per_cell": 1.0
    },
    {
      "x_m": 435241.0,
      "y_m": 4584288.0,
      "crowd_density_agents_per_cell": 12.0
    },
    {
      "x_m": 435181.0,
      "y_m": 4584528.0,
      "crowd_density_agents_per_cell": 1.0
    },
    {
      "x_m": 435061.0,
      "y_m": 4584138.0,
      "crowd_density_agents_per_cell": 16.0
    },
    {
      "x_m": 435097.0,
      "y_m": 4584168.0,
      "crowd_density_agents_per_cell": 7.0
    },
    {
      "x_m": 435187.0,
      "y_m": 4584474.0,
      "crowd_density_agents_per_cell": 1.0
    },
    {
      "x_m": 435211.0,
      "y_m": 4584486.0,
      "crowd_density_agents_per_cell": 1.0
    },
    {
      "x_m": 435169.0,
      "y_m": 4584540.0,
      "crowd_density_agents_per_cell": 4.0
    },
    {
      "x_m": 435229.0,
      "y_m": 4584504.0,
      "crowd_density_agents_per_cell": 5.0
    },
    {
      "x_m": 435433.0,
      "y_m": 4584660.0,
      "crowd_density_agents_per_cell": 3.0
    },
    {
      "x_m": 435517.0,
      "y_m": 4584582.0,
      "crowd_density_agents_per_cell": 1.0
    },
    {
      "x_m": 434977.0,
      "y_m": 4584720.0,
      "crowd_density_agents_per_cell": 1.0
    },
    {
      "x_m": 435391.0,
      "y_m": 4584642.0,
      "crowd_density_agents_per_cell": 3.0
    },
    {
      "x_m": 435181.0,
      "y_m": 4584522.0,
      "crowd_density_agents_per_cell": 1.0
    },
    {
      "x_m": 435391.0,
      "y_m": 4584540.0,
      "crowd_density_agents_per_cell": 4.0
    },
    {
      "x_m": 435151.0,
      "y_m": 4584168.0,
      "crowd_density_agents_per_cell": 2.0
    },
    {
      "x_m": 435313.0,
      "y_m": 4584714.0,
      "crowd_density_agents_per_cell": 5.0
    },
    {
      "x_m": 435505.0,
      "y_m": 4584588.0,
      "crowd_density_agents_per_cell": 5.0
    },
    {
      "x_m": 434977.0,
      "y_m": 4584756.0,
      "crowd_density_agents_per_cell": 1.0
    },
    {
      "x_m": 435109.0,
      "y_m": 4584768.0,
      "crowd_density_agents_per_cell": 2.0
    },
    {
      "x_m": 435373.0,
      "y_m": 4584438.0,
      "crowd_density_agents_per_cell": 4.0
    },
    {
      "x_m": 435481.0,
      "y_m": 4584600.0,
      "crowd_density_agents_per_cell": 1.0
    },
    {
      "x_m": 435079.0,
      "y_m": 4584156.0,
      "crowd_density_agents_per_cell": 5.0
    },
    {
      "x_m": 435385.0,
      "y_m": 4584678.0,
      "crowd_density_agents_per_cell": 1.0
    },
    {
      "x_m": 435271.0,
      "y_m": 4584324.0,
      "crowd_density_agents_per_cell": 3.0
    },
    {
      "x_m": 435163.0,
      "y_m": 4584546.0,
      "crowd_density_agents_per_cell": 2.0
    },
    {
      "x_m": 435109.0,
      "y_m": 4584792.0,
      "crowd_density_agents_per_cell": 1.0
    },
    {
      "x_m": 435445.0,
      "y_m": 4584636.0,
      "crowd_density_agents_per_cell": 1.0
    },
    {
      "x_m": 435325.0,
      "y_m": 4584876.0,
      "crowd_density_agents_per_cell": 3.0
    },
    {
      "x_m": 435445.0,
      "y_m": 4584630.0,
      "crowd_density_agents_per_cell": 2.0
    },
    {
      "x_m": 434983.0,
      "y_m": 4584726.0,
      "crowd_density_agents_per_cell": 2.0
    },
    {
      "x_m": 435451.0,
      "y_m": 4584606.0,
      "crowd_density_agents_per_cell": 9.0
    },
    {
      "x_m": 435487.0,
      "y_m": 4584594.0,
      "crowd_density_agents_per_cell": 5.0
    },
    {
      "x_m": 435175.0,
      "y_m": 4584540.0,
      "crowd_density_agents_per_cell": 1.0
    },
    {
      "x_m": 435445.0,
      "y_m": 4584606.0,
      "crowd_density_agents_per_cell": 3.0
    },
    {
      "x_m": 435337.0,
      "y_m": 4584708.0,
      "crowd_density_agents_per_cell": 2.0
    },
    {
      "x_m": 435115.0,
      "y_m": 4584678.0,
      "crowd_density_agents_per_cell": 1.0
    },
    {
      "x_m": 435031.0,
      "y_m": 4584624.0,
      "crowd_density_agents_per_cell": 4.0
    },
    {
      "x_m": 435103.0,
      "y_m": 4584174.0,
      "crowd_density_agents_per_cell": 2.0
    },
    {
      "x_m": 435289.0,
      "y_m": 4584306.0,